name,category,addres_full,website,phone_number,rating,review_count,longitude,latitude
Praktik Psikolog dan Pusat Terapi Anak,Psychologist,"RJFF+JQF Praktik Psikolog dan Pusat Terapi Anak, Oebufu, Kec. Oebobo, Kota Kupang, Nusa Tenggara Tim., Indonesia",https://www.instagram.com/yeskidz_?igsh=YzljYTk1ODg3Zg==,,4.8,23,123.6244505,-10.1758706
"Praktek Mozes Lazarus Touw, M.Psi., Psikolog",Mental health service,"RH8Q+P7H Praktek Mozes Lazarus Touw, M.Psi., Psikolog, Air Nona, Kota Raja, Kupang City, East Nusa Tenggara, Indonesia",,+62 895-4053-34751,5,2,123.588177,-10.1829441
Konsultan Psikologi Sepe Growth,Medical clinic,"RJVH+JV8 Konsultan Psikologi Sepe Growth, Unnamed Road, Oesapa Barat, Kelapa Lima, Kupang City, East Nusa Tenggara 85228, Indonesia",,,5,1,123.6297111,-10.1559682
Rumah SEJIWA FLOBAMORA,Mental health service,"RJMC+6M4 Rumah SEJIWA FLOBAMORA, Jl. Beringin Merah, Kayu Putih, Oebobo, Kupang City, East Nusa Tenggara, Indonesia",,+62 821-3739-3200,5,6,123.6217066,-10.1669934
Klinik Utama Jiwa Dewanta Mental Healthcare (DMH),Specialized clinic,"Klinik Utama Jiwa Dewanta Mental Healthcare (DMH), Jl. Ainiba, Pasir Panjang, Kec. Kota Lama, Kota Kupang, Nusa Tenggara Tim. 85227, Indonesia",,+62 812-3900-3006,4.1,11,123.6047884,-10.1520851
Prodi Psikologi Undana,University,"RJ82+PRF Prodi Psikologi Undana, Naikoten I, Kota Raja, Kupang City, East Nusa Tenggara, Indonesia",https://psikologi.undana.ac.id/,,5,2,123.6019924,-10.1828953
Lembaga Konsultasi Psikologi Altruist,Main customs office,"Lembaga Konsultasi Psikologi Altruist, RSS Oesapa Blok A/No.10, Kel, Oesapa, Kelapa Lima, Kupang City, East Nusa Tenggara, Indonesia",,,,,123.6424458,-10.1532702