name,category,addres_full,website,phone_number,rating,review_count,longitude,latitude
"Praktik Psikolog ""Psikologika""",Psychologist,"Praktik Psikolog ""Psikologika"", Jl. Laute IB No.9B, Mandonga, Kendari City, South East Sulawesi 93111, Indonesia",,+62 857-5720-4427,5,61,122.5152874,-3.968086
Genesis Psychological Clinic,Psychologist,"Genesis Psychological Clinic, Jl. Jend. Ahmad Yani No.220, Anawai, Kec. Wua-Wua, Kota Kendari, Sulawesi Tenggara 93117, Indonesia",,,5,69,122.4982878,-4.0090336
Praktek Psikolog ADJ_MADO,Psychologist,"Praktek Psikolog ADJ_MADO, BTN PNS Blok XIV Jl. Apel No.17, Watubangga, Kec. Baruga, Kota Kendari, Sulawesi Tenggara 93116, Indonesia",,+62 817-897-771,4.9,18,122.4800247,-4.0259663
Swarahati Consulting,Psychologist,"Swarahati Consulting, Jl. Bunga Seroja Lorong Bonsai No.27, Lahundape, Kec. Kendari Bar., Kota Kendari, Sulawesi Tenggara 93121, Indonesia",,+62 813-9398-2764,5,51,122.5291859,-3.9660206
Mitra Psikologi,Psychologist,"XGX2+8CV Mitra Psikologi, Jl. Sorumba, Bonggoeya, Kec. Wua-Wua, Kota Kendari, Sulawesi Tenggara 93117, Indonesia",,+62 852-2909-5583,4.8,6,122.5010574,-4.0016472
Zona Solution Psikologi,Psychologist,"Zona Solution Psikologi, Jl. Kijang, Rahandouna, Kec. Poasia, Kota Kendari, Sulawesi Tenggara, Indonesia",,+62 878-7249-2742,4.6,11,122.5494634,-4.0085868
Yayasan Praktek Psikolog Indonesia Cabang Makassar,Psychologist,"Yayasan Praktek Psikolog Indonesia Cabang Makassar, Gedung Confie Indonesia - Makassar, Blk. D No.10, Karampuang, Kec. Panakkukang, Kota Makassar, Sulawesi Selatan 90231, Indonesia",http://www.praktekpsikolog.com/,+62 812-1345-8601,4.9,16,119.4529134,-5.1485246
"Praktik Psikologi Widia Julianti Siddik, M.Psi, Psikolog",Psychologist,"Praktik Psikologi Widia Julianti Siddik, M.Psi, Psikolog, Jl. A. Mappaoddang. H2 Lama, Kota Makassar, Sulawesi Selatan 90223, Indonesia",https://widiapsi.carrd.co/,+62 812-5388-3789,5,86,119.4150194,-5.1743026
Layanan Psikologi Makassar | Cognito,Psychologist,"Layanan Psikologi Makassar | Cognito, Bumi Permata Hijau, Jl. Bumi Raya Komp. (BPH) No.18 Blok B3, Gn. Sari, Kec. Rappocini, Kota Makassar, Sulawesi Selatan 90221, Indonesia",https://cognitoindonesia.wixsite.com/cognito,+62 852-5597-2392,5,63,119.441484,-5.184869
AMBAR PSIKOLOGI SOLUSI,Corporate office,"XHM2+MWH AMBAR PSIKOLOGI SOLUSI, Rahandouna, Kec. Poasia, Kota Kendari, Sulawesi Tenggara 93232, Indonesia",,+62 811-4051-200,5,40,122.5523529,-4.0158004
Home Psychologist,Mental health clinic,"Home Psychologist, Perumahan Dosen Kampus Baru Blok R no. 7, Kota Kendari, Sulawesi Tenggara 93231, Indonesia",https://www.blogger.com/blog/posts/4498838991161743247,,4.5,4,122.528409,-4.0129032
PSIKOMORFOSA Lembaga Layanan Psikologi,Psychologist,"PSIKOMORFOSA Lembaga Layanan Psikologi, Jalan Kompleks Agraria Blok Q2 A, Kec. Rappocini, Kota Makassar, Sulawesi Selatan 90222, Indonesia",,+62 822-9231-8587,4.8,31,119.4480497,-5.1753363
LEMBAGA PSIKOLOGI EXCELLENT,Psychologist,"LEMBAGA PSIKOLOGI EXCELLENT, Jalan A.P Pettarani Kompleks Ruko Bisnis Centre 3, Blk. C - D No.15, Masale, Kec. Panakkukang, Kota Makassar, Sulawesi Selatan 90222, Indonesia",,+62 411 433666,4.8,19,119.438163,-5.1491414
Praktek Psikiater dr. Lili Tunggal Sp.KJ,Psychiatrist,"Praktek Psikiater dr. Lili Tunggal Sp.KJ, Jl. DR. Ratulangi No.180, Parang, Kec. Mamajang, Kota Makassar, Sulawesi Selatan, Indonesia",,+62 852-4444-2630,5,106,119.417972,-5.1632359
Karracare Layanan Psikologi,Psychotherapist,"Karracare Layanan Psikologi, Jl. Dr. Wahidin No.143 C, Lamangga, Kec. Murhum, Kota Bau-Bau, Sulawesi Tenggara 93713, Indonesia",https://www.instagram.com/layananpsikologi.karracare/profilecard/?igsh=bjM4anl1aW5jb2lx,+62 822-9025-6730,5,84,122.5999402,-5.4700886
Praktek Psikolog,Store,"Praktek Psikolog, Jl. Monumen Emmy Saelan No.5, Gn. Sari, Kec. Rappocini, Kota Makassar, Sulawesi Selatan 90221, Indonesia",,+62 411 841189,5,4,119.4398944,-5.1766471
Klinik Psikologi Wangi Embun,Mental health clinic,"3V7R+MPX Klinik Psikologi Wangi Embun, Kalukubula, Sigi Biromaru, Sigi Regency, Central Sulawesi, Indonesia",,+62 821-9688-3080,5,5,119.8918594,-0.9357625
Praktik Psikolog Fithrah Fadhilah Hasbi,Psychologist,"2H35+9FP Praktik Psikolog Fithrah Fadhilah Hasbi, Jl. Wua Eha, Anggoeya, Kec. Poasia, Kota Kendari, Sulawesi Tenggara 93232, Indonesia",,,,,122.5587046,-3.9965341
Tes Stifin Makassar Gowa Samata (potensi bakat karakter GENETIK ),Psychologist,"Tes Stifin Makassar Gowa Samata (potensi bakat karakter GENETIK ), perum bumi zarinda, blok AO no.19, Samata, Kec. Pattallassang, Kabupaten Gowa, Sulawesi Selatan 92118, Indonesia",,+62 882-4208-5807,4.2,5,119.5205601,-5.2052924
Lembaga Psikologi Progres,Psychologist,"RCJR+CJW Lembaga Psikologi Progres, Jl. Mapala Raya, Tidung, Kec. Rappocini, Kota Makassar, Sulawesi Selatan 90222, Indonesia",https://www.instagram.com/psikologiprogres/,+62 811-4111-812,5,13,119.4415687,-5.1688945
Laboratorium Psikologi UHO,College,"XGVC+4CP Laboratorium Psikologi UHO, Kambu, Kec. Kambu, Kota Kendari, Sulawesi Tenggara 93561, Indonesia",,,5,13,122.5210685,-4.0071642
Layanan Psikologi Bermakna,Psychologist,"Layanan Psikologi Bermakna, Jl. Delta Mas II Blok A4, Batua, Kec. Manggala, Kota Makassar, Sulawesi Selatan 90233, Indonesia",http://wa.me/089510696112,+62 895-1069-69112,5,21,119.4623273,-5.1611861
"Biro Konsultasi & Pelayanan Psikologis ""HUMANITY""",Psychologist,"Biro Konsultasi & Pelayanan Psikologis ""HUMANITY"", Jl. Dr. Wahidin, Besusu Bar., Kec. Palu Bar., Kota Palu, Sulawesi Tengah 94111, Indonesia",,+62 852-3200-9871,5,1,119.8665449,-0.8968889
Daya Potensia Indonesia,Psychologist,"Daya Potensia Indonesia, Jl. Raya Pendidikan No.9 Blok G1, Tidung, Rappocini, Makassar City, South Sulawesi 90222, Indonesia",,+62 811-430-253,5,16,119.4408763,-5.1710717
Biro Psikologi Bonafide,Psychologist,"Biro Psikologi Bonafide, Jl. Poros Singki'-Kadundung Km. 1.2, Tampak, Saloso, Laang Tanduk, Rantepao, 91835, Indonesia",,+62 877-7456-1000,,,119.885092,-2.9787972
Terapi Psikologi ABK,Psychotherapist,"Terapi Psikologi ABK, Jl. Ahmad Mustin No.99, Laloeha, Kec. Kolaka, Kabupaten Kolaka, Sulawesi Tenggara 93561, Indonesia",,,,,121.6105189,-4.066994